{
  "schema_version":"1.0","candidate_id":"SYNTHETIC_INFRASTRUCTURE_CABLE_TEST","candidate_version":"1.0.0-synthetic","status":"BLOCKED","synthetic":true,"scientific_candidate":false,"theory_claim_authorized":false,
  "ontology":{"status":"EXPLICIT_SYNTHETIC","description":"nonphysical metadata-only cable test"},"state_space":{"status":"BLOCKED","description":"deliberately absent physical state space"},"elementary_variables":[],"symmetries":[],"dynamics":{"status":"BLOCKED"},"amplitude_or_measure":{"status":"BLOCKED"},"composition_gluing":{"status":"BLOCKED"},
  "parameters":[{"id":"beta","status":"UNFIXED","value":null,"benchmark_input_influenced":false},{"id":"c6","status":"SYMBOLIC_UNFIXED","value":null,"benchmark_input_influenced":false}],"functional_freedom":{"status":"UNKNOWN"},"regulator":{"status":"BLOCKED"},"extension_or_renormalization":{"status":"BLOCKED"},"physical_sector":{"status":"BLOCKED"},
  "same_realization_chain":{"status":"BLOCKED","candidate_version":"1.0.0-synthetic","microscopic_object_id":null,"dynamics_id":null,"parameter_map_id":null,"regulator_id":null,"continuum_map_id":null,"IR_realization_id":null,"GR_map_id":null,"observable_id":null},
  "uv_ir_map":{"status":"BLOCKED"},"gr_limit":{"status":"BLOCKED"},"observables":[],"uncertainties":[],"predictions_or_discriminators":[],
  "claim_locks":{"qgr_theory_established":false,"experimental_confirmation":false,"beta_set_to_one_authorized":false,"qgr_six_derivative_coefficient_fixed":false,"c6_running_authorized":false,"strong_hyperbolicity_established":false,"physical_ghost_claim_authorized":false,"quantum_unitarity_established":false,"global_interacting_measure_established":false,"regulator_removal_established":false,"uv_complete":false,"new_physics_found":false,"kmqgb_new_required_authorized":false},
  "blockers":["SYNTHETIC_BLOCKED_PARENT_DYNAMICS","SYNTHETIC_BLOCKED_SAME_REALIZATION","SYNTHETIC_BLOCKED_OBSERVABLE"],"source_provenance":["protocol/QGR_PROGRAMME_READINESS_100_CONTRACT.json"],"artifact_hashes":{"self":"COMPUTED_BY_HANDSHAKE"},"software_environment":{"purpose":"synthetic_nonphysical_infrastructure_test"},"benchmark_interface_version":"KMQGB_candidate_gravity_record_v1_3@d23f34cba57b220dd29474c0651bc727d6d85eae"
}
